{
  "run_date": "20260409",
  "section_id": "surface_marine_impacts",
  "section_title": "지상 및 해상 영향 해석",
  "source_domains": [
    "surface",
    "sfc12h_synoptic"
  ],
  "time_catalog": [
    "2026-04-09 00:00",
    "2026-04-09 12:00"
  ],
  "region_catalog": [
    {
      "region_id": "ecs_north",
      "region_label": "동중국해 북부"
    },
    {
      "region_id": "japan_east_offshore",
      "region_label": "일본 동부 해상"
    },
    {
      "region_id": "japan_w",
      "region_label": "일본 서부"
    },
    {
      "region_id": "kp_north",
      "region_label": "한반도 북부"
    },
    {
      "region_id": "kp_south",
      "region_label": "한반도 남부"
    },
    {
      "region_id": "liao_bohai",
      "region_label": "요동반도/발해만"
    },
    {
      "region_id": "manchuria_s",
      "region_label": "만주 남부"
    },
    {
      "region_id": "ws_mid",
      "region_label": "서해 중부"
    }
  ],
  "signal_catalog": [
    {
      "signal_key": "front",
      "signal_label": "전선"
    },
    {
      "signal_key": "frontal_zone",
      "signal_label": "전선대"
    },
    {
      "signal_key": "gale_wind_area",
      "signal_label": "강풍역"
    },
    {
      "signal_key": "high_center",
      "signal_label": "고기압 중심"
    },
    {
      "signal_key": "low_center",
      "signal_label": "저기압 중심"
    },
    {
      "signal_key": "movement_signal",
      "signal_label": "이동 신호"
    },
    {
      "signal_key": "strong_wind_zone",
      "signal_label": "강풍대"
    },
    {
      "signal_key": "surface_ridge",
      "signal_label": "지상 능선"
    },
    {
      "signal_key": "surface_ridge_axis",
      "signal_label": "지상 능선축"
    },
    {
      "signal_key": "surface_trough",
      "signal_label": "지상 기압골"
    },
    {
      "signal_key": "surface_trough_axis",
      "signal_label": "지상 기압골축"
    },
    {
      "signal_key": "synoptic_high_center",
      "signal_label": "종관 규모 고기압 중심"
    },
    {
      "signal_key": "synoptic_low_center",
      "signal_label": "종관 규모 저기압 중심"
    },
    {
      "signal_key": "tight_pressure_gradient",
      "signal_label": "강한 기압경도대"
    },
    {
      "signal_key": "tight_pressure_gradient_zone",
      "signal_label": "기압경도대"
    },
    {
      "signal_key": "wet_area",
      "signal_label": "습윤역"
    }
  ],
  "evidence_catalog": [
    "surf_12h_2026040900",
    "surf_12h_2026040912",
    "surf_anl_6h_2026040900",
    "surf_anl_6h_2026040912"
  ],
  "rule_catalog": [
    {
      "rule_id": "spring_heat_low_vs_frontal_low",
      "section_no": 1,
      "page_range": "p.4-11"
    },
    {
      "rule_id": "summer_monsoon_lowlevel_pattern",
      "section_no": 2,
      "page_range": "p.12-17"
    },
    {
      "rule_id": "skewt_llj_heavy_rain",
      "section_no": 5,
      "page_range": "p.34-43"
    },
    {
      "rule_id": "front_boundary_identification",
      "section_no": 9,
      "page_range": "p.68-77"
    },
    {
      "rule_id": "llj_narrow_convective_rain",
      "section_no": 11,
      "page_range": "p.84-89"
    },
    {
      "rule_id": "jet_coupling_heavy_rain",
      "section_no": 13,
      "page_range": "p.98-101"
    },
    {
      "rule_id": "changma_like_structure",
      "section_no": 15,
      "page_range": "p.114-125"
    },
    {
      "rule_id": "explosive_cyclone_risk",
      "section_no": 24,
      "page_range": "p.210-217"
    }
  ],
  "row_fields": [
    "time_idx",
    "domain",
    "region_idx",
    "signal_idx",
    "stage",
    "count",
    "detail_text",
    "evidence_idx_list"
  ],
  "rows": [
    [
      0,
      "surface",
      0,
      0,
      "stage1",
      1,
      "전선 존재",
      [
        2
      ]
    ],
    [
      0,
      "surface",
      0,
      4,
      "stage1",
      1,
      "저기압 중심 존재",
      [
        2
      ]
    ],
    [
      0,
      "surface",
      0,
      9,
      "stage1",
      1,
      "지상 기압골 존재",
      [
        2
      ]
    ],
    [
      0,
      "surface",
      0,
      9,
      "stage2",
      1,
      "지상 기압골 세부 판독: 위치 영역 내부",
      [
        2
      ]
    ],
    [
      0,
      "surface",
      0,
      15,
      "stage1",
      1,
      "습윤역 존재",
      [
        2
      ]
    ],
    [
      0,
      "surface",
      0,
      15,
      "stage2",
      2,
      "습윤역 세부 판독: 규모 광역, 위치 영역 내부",
      [
        2
      ]
    ],
    [
      0,
      "surface",
      1,
      0,
      "stage1",
      1,
      "전선 존재",
      [
        2
      ]
    ],
    [
      0,
      "surface",
      1,
      3,
      "stage2",
      1,
      "고기압 중심 세부 판독: 위치 서쪽",
      [
        2
      ]
    ],
    [
      0,
      "surface",
      1,
      4,
      "stage1",
      1,
      "저기압 중심 존재",
      [
        2
      ]
    ],
    [
      0,
      "surface",
      1,
      6,
      "stage2",
      1,
      "강풍대 세부 판독: 강도 보통",
      [
        2
      ]
    ],
    [
      0,
      "surface",
      1,
      9,
      "stage1",
      1,
      "지상 기압골 존재",
      [
        2
      ]
    ],
    [
      0,
      "surface",
      1,
      15,
      "stage1",
      1,
      "습윤역 존재",
      [
        2
      ]
    ],
    [
      0,
      "surface",
      1,
      15,
      "stage2",
      2,
      "습윤역 세부 판독: 규모 광범위, 위치 서쪽",
      [
        2
      ]
    ],
    [
      0,
      "surface",
      2,
      0,
      "stage1",
      1,
      "전선 존재",
      [
        2
      ]
    ],
    [
      0,
      "surface",
      2,
      3,
      "stage2",
      1,
      "고기압 중심 세부 판독: 위치 영역 내부",
      [
        2
      ]
    ],
    [
      0,
      "surface",
      2,
      6,
      "stage1",
      1,
      "강풍대 존재",
      [
        2
      ]
    ],
    [
      0,
      "surface",
      2,
      15,
      "stage1",
      1,
      "습윤역 존재",
      [
        2
      ]
    ],
    [
      0,
      "surface",
      2,
      15,
      "stage2",
      2,
      "습윤역 세부 판독: 규모 광범위, 위치 영역 내부",
      [
        2
      ]
    ],
    [
      0,
      "surface",
      3,
      0,
      "stage1",
      1,
      "전선 존재",
      [
        2
      ]
    ],
    [
      0,
      "surface",
      3,
      0,
      "stage2",
      2,
      "전선 세부 판독: 위치 영역 내부, 유형 cold_front",
      [
        2
      ]
    ],
    [
      0,
      "surface",
      3,
      6,
      "stage1",
      1,
      "강풍대 존재",
      [
        2
      ]
    ],
    [
      0,
      "surface",
      3,
      6,
      "stage2",
      1,
      "강풍대 세부 판독: 강도 보통",
      [
        2
      ]
    ],
    [
      0,
      "surface",
      3,
      15,
      "stage1",
      1,
      "습윤역 존재",
      [
        2
      ]
    ],
    [
      0,
      "surface",
      3,
      15,
      "stage2",
      2,
      "습윤역 세부 판독: 규모 광범위, 위치 영역 내부",
      [
        2
      ]
    ],
    [
      0,
      "surface",
      4,
      0,
      "stage1",
      1,
      "전선 존재",
      [
        2
      ]
    ],
    [
      0,
      "surface",
      4,
      0,
      "stage2",
      2,
      "전선 세부 판독: 위치 영역 내부, 유형 cold_front",
      [
        2
      ]
    ],
    [
      0,
      "surface",
      4,
      6,
      "stage1",
      1,
      "강풍대 존재",
      [
        2
      ]
    ],
    [
      0,
      "surface",
      4,
      6,
      "stage2",
      1,
      "강풍대 세부 판독: 강도 보통",
      [
        2
      ]
    ],
    [
      0,
      "surface",
      4,
      15,
      "stage1",
      1,
      "습윤역 존재",
      [
        2
      ]
    ],
    [
      0,
      "surface",
      4,
      15,
      "stage2",
      2,
      "습윤역 세부 판독: 규모 광범위, 위치 영역 내부",
      [
        2
      ]
    ],
    [
      0,
      "surface",
      5,
      0,
      "stage2",
      2,
      "전선 세부 판독: 위치 영역 내부, 유형 cold_front",
      [
        2
      ]
    ],
    [
      0,
      "surface",
      5,
      4,
      "stage2",
      1,
      "저기압 중심 세부 판독: 위치 영역 내부",
      [
        2
      ]
    ],
    [
      0,
      "surface",
      5,
      9,
      "stage1",
      1,
      "지상 기압골 존재",
      [
        2
      ]
    ],
    [
      0,
      "surface",
      5,
      9,
      "stage2",
      1,
      "지상 기압골 세부 판독: 위치 영역 내부",
      [
        2
      ]
    ],
    [
      0,
      "surface",
      5,
      15,
      "stage1",
      1,
      "습윤역 존재",
      [
        2
      ]
    ],
    [
      0,
      "surface",
      5,
      15,
      "stage2",
      2,
      "습윤역 세부 판독: 규모 광범위, 위치 영역 내부",
      [
        2
      ]
    ],
    [
      0,
      "surface",
      6,
      0,
      "stage2",
      2,
      "전선 세부 판독: 위치 영역 내부, 유형 cold_front",
      [
        2
      ]
    ],
    [
      0,
      "surface",
      6,
      3,
      "stage1",
      1,
      "고기압 중심 존재",
      [
        2
      ]
    ],
    [
      0,
      "surface",
      6,
      4,
      "stage2",
      1,
      "저기압 중심 세부 판독: 위치 동쪽",
      [
        2
      ]
    ],
    [
      0,
      "surface",
      6,
      9,
      "stage2",
      1,
      "지상 기압골 세부 판독: 위치 동쪽",
      [
        2
      ]
    ],
    [
      0,
      "surface",
      6,
      15,
      "stage1",
      1,
      "습윤역 존재",
      [
        2
      ]
    ],
    [
      0,
      "surface",
      6,
      15,
      "stage2",
      2,
      "습윤역 세부 판독: 규모 광범위, 위치 영역 내부",
      [
        2
      ]
    ],
    [
      0,
      "surface",
      7,
      0,
      "stage2",
      2,
      "전선 세부 판독: 위치 영역 내부, 유형 cold_front",
      [
        2
      ]
    ],
    [
      0,
      "surface",
      7,
      3,
      "stage1",
      1,
      "고기압 중심 존재",
      [
        2
      ]
    ],
    [
      0,
      "surface",
      7,
      6,
      "stage1",
      1,
      "강풍대 존재",
      [
        2
      ]
    ],
    [
      0,
      "surface",
      7,
      6,
      "stage2",
      1,
      "강풍대 세부 판독: 강도 보통",
      [
        2
      ]
    ],
    [
      0,
      "surface",
      7,
      15,
      "stage1",
      1,
      "습윤역 존재",
      [
        2
      ]
    ],
    [
      0,
      "surface",
      7,
      15,
      "stage2",
      2,
      "습윤역 세부 판독: 규모 광범위, 위치 영역 내부",
      [
        2
      ]
    ],
    [
      0,
      "sfc12h_synoptic",
      0,
      1,
      "stage1",
      1,